<?xml version="1.0" encoding="UTF-8"?>
<map xmlns:xsi="http://www.w3.org/2001/XMLSchema-instance" xmlns="delta3dMap" xsi:schemaLocation="delta3dMap map.xsd">
    <header>
        <name>IntroMap</name>
        <description>This is the intro map for the revised Fire Fighter application. </description>
        <author></author>
        <comment></comment>
        <copyright></copyright>
        <createTimestamp>2006-10-11T11:21:57.0-05:00</createTimestamp>
        <lastUpdateTimestamp>2006-10-11T13:43:49.0-05:00</lastUpdateTimestamp>
        <editorVersion>1.3.0</editorVersion>
        <schemaVersion>1.0</schemaVersion>
    </header>
    <libraries>
        <library>
            <name>fireFighter</name>
            <version></version>
        </library>
    </libraries>
    <actors>
        <actor>
            <type>FlySequence.FlySequence</type>
            <id>1c1ad7ea-2432-4ab6-9071-2f5147e4f07c</id>
            <name>Physical</name>
            <property>
                <name>Center of Gravity</name>
                <vec3>
                    <value1>0.000000</value1>
                    <value2>0.000000</value2>
                    <value3>0.000000</value3>
                </vec3>
            </property>
            <property>
                <name>Collision Box</name>
                <vec3>
                    <value1>0.000000</value1>
                    <value2>0.000000</value2>
                    <value3>0.000000</value3>
                </vec3>
            </property>
            <property>
                <name>Collision Geometry</name>
                <boolean>false</boolean>
            </property>
            <property>
                <name>Collision Length</name>
                <float>0</float>
            </property>
            <property>
                <name>Collision Radius</name>
                <float>0</float>
            </property>
            <property>
                <name>Collision Type</name>
                <enumerated>NONE</enumerated>
            </property>
            <property>
                <name>Enable Dynamics</name>
                <boolean>false</boolean>
            </property>
            <property>
                <name>Initial Ownership</name>
                <enumerated>Server Local</enumerated>
            </property>
            <property>
                <name>Mass</name>
                <float>4.188790321350098</float>
            </property>
            <property>
                <name>Normal Rescaling</name>
                <boolean>true</boolean>
            </property>
            <property>
                <name>Rotation</name>
                <vec3>
                    <value1>0.000000</value1>
                    <value2>0.000000</value2>
                    <value3>0.000000</value3>
                </vec3>
            </property>
            <property>
                <name>Scale</name>
                <vec3>
                    <value1>1.000000</value1>
                    <value2>1.000000</value2>
                    <value3>1.000000</value3>
                </vec3>
            </property>
            <property>
                <name>ShaderGroup</name>
                <string></string>
            </property>
            <property>
                <name>Translation</name>
                <vec3>
                    <value1>-0.809600</value1>
                    <value2>-46.540710</value2>
                    <value3>15.300002</value3>
                </vec3>
            </property>
        </actor>
        <actor>
            <type>DDGActor.DDGActor</type>
            <id>1f5b083f-5760-42d8-ab64-517de6d5220d</id>
            <name>DDGActor</name>
            <property>
                <name>Center of Gravity</name>
                <vec3>
                    <value1>0.000000</value1>
                    <value2>0.000000</value2>
                    <value3>0.000000</value3>
                </vec3>
            </property>
            <property>
                <name>Collision Box</name>
                <vec3>
                    <value1>0.000000</value1>
                    <value2>0.000000</value2>
                    <value3>0.000000</value3>
                </vec3>
            </property>
            <property>
                <name>Collision Geometry</name>
                <boolean>false</boolean>
            </property>
            <property>
                <name>Collision Length</name>
                <float>0</float>
            </property>
            <property>
                <name>Collision Radius</name>
                <float>0</float>
            </property>
            <property>
                <name>Collision Type</name>
                <enumerated>NONE</enumerated>
            </property>
            <property>
                <name>CoordinateSystem</name>
                <enumerated>REL</enumerated>
            </property>
            <property>
                <name>Enable Dynamics</name>
                <boolean>false</boolean>
            </property>
            <property>
                <name>Initial Ownership</name>
                <enumerated>Server Local</enumerated>
            </property>
            <property>
                <name>Mass</name>
                <float>4.188790321350098</float>
            </property>
            <property>
                <name>Model</name>
                <resourceType>StaticMeshes</resourceType>
                <resourceDisplayName>StaticMeshes:ddg:ddg-51.flt</resourceDisplayName>
                <resource>StaticMeshes:ddg:ddg-51.flt</resource>
            </property>
            <property>
                <name>Normal Rescaling</name>
                <boolean>true</boolean>
            </property>
            <property>
                <name>Rotation</name>
                <vec3>
                    <value1>0.000000</value1>
                    <value2>0.000000</value2>
                    <value3>0.000000</value3>
                </vec3>
            </property>
            <property>
                <name>Scale</name>
                <vec3>
                    <value1>1.000000</value1>
                    <value2>1.000000</value2>
                    <value3>1.000000</value3>
                </vec3>
            </property>
            <property>
                <name>ShaderGroup</name>
                <string></string>
            </property>
            <property>
                <name>Translation</name>
                <vec3>
                    <value1>0.000000</value1>
                    <value2>0.000000</value2>
                    <value3>100.000000</value3>
                </vec3>
            </property>
        </actor>
        <actor>
            <type>PlayerActor.PlayerActor</type>
            <id>583d7ca4-675a-4ac7-8fda-56ab049d7b3d</id>
            <name>PlayerActor</name>
            <property>
                <name>Center of Gravity</name>
                <vec3>
                    <value1>0.000000</value1>
                    <value2>0.000000</value2>
                    <value3>0.000000</value3>
                </vec3>
            </property>
            <property>
                <name>Collision Box</name>
                <vec3>
                    <value1>0.000000</value1>
                    <value2>0.000000</value2>
                    <value3>0.000000</value3>
                </vec3>
            </property>
            <property>
                <name>Collision Geometry</name>
                <boolean>false</boolean>
            </property>
            <property>
                <name>Collision Length</name>
                <float>0</float>
            </property>
            <property>
                <name>Collision Radius</name>
                <float>0</float>
            </property>
            <property>
                <name>Collision Type</name>
                <enumerated>NONE</enumerated>
            </property>
            <property>
                <name>Enable Dynamics</name>
                <boolean>false</boolean>
            </property>
            <property>
                <name>Initial Ownership</name>
                <enumerated>Server Local</enumerated>
            </property>
            <property>
                <name>Mass</name>
                <float>4.188790321350098</float>
            </property>
            <property>
                <name>Normal Rescaling</name>
                <boolean>true</boolean>
            </property>
            <property>
                <name>Rotation</name>
                <vec3>
                    <value1>0.000000</value1>
                    <value2>0.000000</value2>
                    <value3>0.000000</value3>
                </vec3>
            </property>
            <property>
                <name>Scale</name>
                <vec3>
                    <value1>1.000000</value1>
                    <value2>1.000000</value2>
                    <value3>1.000000</value3>
                </vec3>
            </property>
            <property>
                <name>ShaderGroup</name>
                <string></string>
            </property>
            <property>
                <name>Translation</name>
                <vec3>
                    <value1>0.000000</value1>
                    <value2>0.000000</value2>
                    <value3>0.000000</value3>
                </vec3>
            </property>
        </actor>
    </actors>
</map>
